source,snapshot_date,source_rank,player_name,school,position,source_url,report_text,cbs_rank,cbs_summary
CBS_BigBoard_2026,2026-02-26,47,Genesis Smith,Arizona,S,https://www.cbssports.com/nfl/draft/news/2026-nfl-draft-top-prospects-big-board-rankings/,"Smith has everything you could want athletically to be a do-it-all safety in the NFL. In his two seasons as a starter, he's been able to consistently get his hands on footballs with nine pass breakups and four picks.",47,"Smith has everything you could want athletically to be a do-it-all safety in the NFL. In his two seasons as a starter, he's been able to consistently get his hands on footballs with nine pass breakups and four picks."
CBS_BigBoard_2026,2026-02-26,48,Parker Brailsford,Alabama,IOL,https://www.cbssports.com/nfl/draft/news/2026-nfl-draft-top-prospects-big-board-rankings/,"Brailsford isn't for every scheme. Gap-heavy teams should look elsewhere, but if you want your center on the move, he's your guy. His ability to locate in space stands out in this class.",48,"Brailsford isn't for every scheme. Gap-heavy teams should look elsewhere, but if you want your center on the move, he's your guy. His ability to locate in space stands out in this class."
CBS_BigBoard_2026,2026-02-26,49,A'Mauri Washington,Oregon,DT,https://www.cbssports.com/nfl/draft/news/2026-nfl-draft-top-prospects-big-board-rankings/,"Washington is a freak athlete at nose tackle, capable of being a weapon on stunts and slants. His ability to get off the football is special for a 330-pounder.",49,"Washington is a freak athlete at nose tackle, capable of being a weapon on stunts and slants. His ability to get off the football is special for a 330-pounder."
CBS_BigBoard_2026,2026-02-26,50,Josiah Trotter,Missouri,LB,https://www.cbssports.com/nfl/draft/news/2026-nfl-draft-top-prospects-big-board-rankings/,"If the last name sounds familiar, it's because he's the son of former All-Pro linebacker Jeremiah Trotter. Unlike his brother Jeremiah, who's in the NFL now, Josiah has much better size to be a highly coveted prospect. He's been outstanding coming downhill this season with a knack for getting into the backfield.",50,"If the last name sounds familiar, it's because he's the son of former All-Pro linebacker Jeremiah Trotter. Unlike his brother Jeremiah, who's in the NFL now, Josiah has much better size to be a highly coveted prospect. He's been outstanding coming downhill this season with a knack for getting into the backfield."
CBS_BigBoard_2026,2026-02-26,51,Christen Miller,Georgia,DT,https://www.cbssports.com/nfl/draft/news/2026-nfl-draft-top-prospects-big-board-rankings/,"Miller is a long defensive tackle who looks like a prototypical 3-4 defensive end. While he's a work in progress as a pass rusher, like many Georgia defensive linemen, he can play the run at a high level already.",51,"Miller is a long defensive tackle who looks like a prototypical 3-4 defensive end. While he's a work in progress as a pass rusher, like many Georgia defensive linemen, he can play the run at a high level already."
CBS_BigBoard_2026,2026-02-26,52,Kenyon Sadiq,Oregon,TE,https://www.cbssports.com/nfl/draft/news/2026-nfl-draft-top-prospects-big-board-rankings/,"Sadiq is such an explosive athlete at the tight end position, but he's struggled to develop into an all-around route runner in his first season as a starter. He's still such a good YAC weapon and move blocker to be coveted highly.",52,"Sadiq is such an explosive athlete at the tight end position, but he's struggled to develop into an all-around route runner in his first season as a starter. He's still such a good YAC weapon and move blocker to be coveted highly."
CBS_BigBoard_2026,2026-02-26,53,Mateen Ibirogba,Wake Forest,DT,https://www.cbssports.com/nfl/draft/news/2026-nfl-draft-top-prospects-big-board-rankings/,The former Georgetown defender has been one of the breakout prospects of the college football season. He's one of the twitchier defensive tackles in the class and already has 19 pressures for the Demon Deacons.,53,The former Georgetown defender has been one of the breakout prospects of the college football season. He's one of the twitchier defensive tackles in the class and already has 19 pressures for the Demon Deacons.
CBS_BigBoard_2026,2026-02-26,54,Iapani Laloulu,Oregon,IOL,https://www.cbssports.com/nfl/draft/news/2026-nfl-draft-top-prospects-big-board-rankings/,Watching Laloulu clear out defensive tackles on double-teams is a thing of beauty. He's physical and built low to the earth to generate movement. It's why he's been starting since his freshman year in 2023.,54,Watching Laloulu clear out defensive tackles on double-teams is a thing of beauty. He's physical and built low to the earth to generate movement. It's why he's been starting since his freshman year in 2023.
CBS_BigBoard_2026,2026-02-26,55,Eli Stowers,Vanderbilt,TE,https://www.cbssports.com/nfl/draft/news/2026-nfl-draft-top-prospects-big-board-rankings/,"Stowers has always been a high-end athlete, but he's had to grow into the tight end position. This has been his best season so far, with 38 catches for 543 yards and four scores.",55,"Stowers has always been a high-end athlete, but he's had to grow into the tight end position. This has been his best season so far, with 38 catches for 543 yards and four scores."
CBS_BigBoard_2026,2026-02-26,56,Josh Hoover,TCU,QB,https://www.cbssports.com/nfl/draft/news/2026-nfl-draft-top-prospects-big-board-rankings/,"Hoover looks unlikely to declare at this point, but I remain impressed by the NFL-translatable skills he shows on a weekly basis. He just needs to reel himself in from trying to do too much in big situations.",56,"Hoover looks unlikely to declare at this point, but I remain impressed by the NFL-translatable skills he shows on a weekly basis. He just needs to reel himself in from trying to do too much in big situations."
CBS_BigBoard_2026,2026-02-26,57,Keionte Scott,Miami (Fla.),S,https://www.cbssports.com/nfl/draft/news/2026-nfl-draft-top-prospects-big-board-rankings/,"Scott is easily my favorite slot cornerback in the draft class. His short-area quickness and toughness are put on full display every week. If he could just wrap up a little more consistently, he could be a top-50 pick.",57,"Scott is easily my favorite slot cornerback in the draft class. His short-area quickness and toughness are put on full display every week. If he could just wrap up a little more consistently, he could be a top-50 pick."
CBS_BigBoard_2026,2026-02-26,58,Cayden Green,Missouri,IOL,https://www.cbssports.com/nfl/draft/news/2026-nfl-draft-top-prospects-big-board-rankings/,"Green has been wildly impressive kicking out to left tackle this season after starting at left guard his first two years in college. Green has allowed only five pressures on 238 pass-blocking snaps. His home is at guard, though, where his natural power really shines.",58,"Green has been wildly impressive kicking out to left tackle this season after starting at left guard his first two years in college. Green has allowed only five pressures on 238 pass-blocking snaps. His home is at guard, though, where his natural power really shines."
CBS_BigBoard_2026,2026-02-26,59,Eric Rivers,Georgia Tech,WR,https://www.cbssports.com/nfl/draft/news/2026-nfl-draft-top-prospects-big-board-rankings/,"We got to see more of Rivers' explosiveness last year, but it's not like it's gone away. He's still arguably the most gifted all-around athlete in this receiver class. Rivers just doesn't have the size to be much more than a deep threat.",59,"We got to see more of Rivers' explosiveness last year, but it's not like it's gone away. He's still arguably the most gifted all-around athlete in this receiver class. Rivers just doesn't have the size to be much more than a deep threat."
CBS_BigBoard_2026,2026-02-26,60,A.J. Haulcy,LSU,S,https://www.cbssports.com/nfl/draft/news/2026-nfl-draft-top-prospects-big-board-rankings/,"Haulcy has been another standout transfer in their secondary with two picks and three pass breakups on the season. I love his range at his size (6-foot, 222 pounds). It reminds me a bit of Colts safety Nick Cross.",60,"Haulcy has been another standout transfer in their secondary with two picks and three pass breakups on the season. I love his range at his size (6-foot, 222 pounds). It reminds me a bit of Colts safety Nick Cross."
CBS_BigBoard_2026,2026-02-26,61,John Mateer,Oklahoma,QB,https://www.cbssports.com/nfl/draft/news/2026-nfl-draft-top-prospects-big-board-rankings/,"Mateer's stock took a hit as he's tried to play through a thumb injury, but the guy we saw before that looked like a first-rounder. He'll be back with the Sooners next year and should factor into a crowded class.",61,"Mateer's stock took a hit as he's tried to play through a thumb injury, but the guy we saw before that looked like a first-rounder. He'll be back with the Sooners next year and should factor into a crowded class."
CBS_BigBoard_2026,2026-02-26,62,Bear Alexander,Oregon,DT,https://www.cbssports.com/nfl/draft/news/2026-nfl-draft-top-prospects-big-board-rankings/,Alexander is a well-traveled defensive tackle who's finally showing why he was a composite top-50 recruit in 2022. He's been a terror vs. the run with the highest run-stop percentage in the country among defensive tackles.,62,Alexander is a well-traveled defensive tackle who's finally showing why he was a composite top-50 recruit in 2022. He's been a terror vs. the run with the highest run-stop percentage in the country among defensive tackles.
CBS_BigBoard_2026,2026-02-26,63,Caleb Tiernan,Northwestern,OT,https://www.cbssports.com/nfl/draft/news/2026-nfl-draft-top-prospects-big-board-rankings/,Tiernan is a four-year starter for the Wildcats and has turned into one of the best pass protectors in the FBS. He's got an odd tackle build in that he's very tall at 6-foot-7 but has relatively short arms. He has swing tackle potential at the next level.,63,Tiernan is a four-year starter for the Wildcats and has turned into one of the best pass protectors in the FBS. He's got an odd tackle build in that he's very tall at 6-foot-7 but has relatively short arms. He has swing tackle potential at the next level.
CBS_BigBoard_2026,2026-02-26,64,Dillon Thieneman,Oregon,S,https://www.cbssports.com/nfl/draft/news/2026-nfl-draft-top-prospects-big-board-rankings/,"Thieneman still needs to get stronger and isn't a sure thing to declare because of that. His ability in coverage is obvious, though, and he could even be a potential corner convert in the NFL.",64,"Thieneman still needs to get stronger and isn't a sure thing to declare because of that. His ability in coverage is obvious, though, and he could even be a potential corner convert in the NFL."
CBS_BigBoard_2026,2026-02-26,65,Caleb Banks,Florida,DT,https://www.cbssports.com/nfl/draft/news/2026-nfl-draft-top-prospects-big-board-rankings/,"Banks is a specimen at 6-foot-6, 330 pounds, but we've only seen him for one game this season due to a foot injury. He has top-10 talent but inconsistent tape last year.",65,"Banks is a specimen at 6-foot-6, 330 pounds, but we've only seen him for one game this season due to a foot injury. He has top-10 talent but inconsistent tape last year."
CBS_BigBoard_2026,2026-02-26,66,Brandon Cisse,South Carolina,CB,https://www.cbssports.com/nfl/draft/news/2026-nfl-draft-top-prospects-big-board-rankings/,Cisse has thrived in South Carolina's defense after transferring from N.C. State. He's allowed only 12 catches on 28 targets for 176 yards this season. His ability to close to the catch point will make him in demand come April.,66,Cisse has thrived in South Carolina's defense after transferring from N.C. State. He's allowed only 12 catches on 28 targets for 176 yards this season. His ability to close to the catch point will make him in demand come April.
CBS_BigBoard_2026,2026-02-26,67,R Mason Thomas,Oklahoma,EDGE,https://www.cbssports.com/nfl/draft/news/2026-nfl-draft-top-prospects-big-board-rankings/,"Thomas won't be for everyone at 6-2, 249 with under 32-inch arms. That low center of gravity combined with elite bend makes him a nightmare for tackles to try to square up. He'll be an early-impact designated pass rusher.",67,"Thomas won't be for everyone at 6-2, 249 with under 32-inch arms. That low center of gravity combined with elite bend makes him a nightmare for tackles to try to square up. He'll be an early-impact designated pass rusher."
CBS_BigBoard_2026,2026-02-26,68,Alex Harkey,Oregon,IOL,https://www.cbssports.com/nfl/draft/news/2026-nfl-draft-top-prospects-big-board-rankings/,"Harkey definitely looks like a guard playing tackle at times, but he also contrasts that with some special reps as well. He's light on his feet for a bigger lineman and it shows with how well he plays in space.",68,"Harkey definitely looks like a guard playing tackle at times, but he also contrasts that with some special reps as well. He's light on his feet for a bigger lineman and it shows with how well he plays in space."
CBS_BigBoard_2026,2026-02-26,69,Hollywood Smothers,N.C. State,RB,https://www.cbssports.com/nfl/draft/news/2026-nfl-draft-top-prospects-big-board-rankings/,"Smothers has been one of the most efficient backs in the country, averaging 6.9 yards per carry this season. He's undersized but difficult to pin down in space and runs hard.",69,"Smothers has been one of the most efficient backs in the country, averaging 6.9 yards per carry this season. He's undersized but difficult to pin down in space and runs hard."
CBS_BigBoard_2026,2026-02-26,70,Connor Lew,Auburn,IOL,https://www.cbssports.com/nfl/draft/news/2026-nfl-draft-top-prospects-big-board-rankings/,Lew's ranking here is a mere formality. He's got first-round talent but tore his ACL earlier this year and looks likely to come back to school as he's only a true junior.,70,Lew's ranking here is a mere formality. He's got first-round talent but tore his ACL earlier this year and looks likely to come back to school as he's only a true junior.
CBS_BigBoard_2026,2026-02-26,71,Julian Neal,Arkansas,CB,https://www.cbssports.com/nfl/draft/news/2026-nfl-draft-top-prospects-big-board-rankings/,"Neal has enjoyed a breakout season for the Razorbacks after transferring from Fresno State . He's broken up six passes and picked off two more. His real value, though, comes from blowing up screens where his 6-foot-2, 208-pound frame really shines.",71,"Neal has enjoyed a breakout season for the Razorbacks after transferring from Fresno State . He's broken up six passes and picked off two more. His real value, though, comes from blowing up screens where his 6-foot-2, 208-pound frame really shines."
CBS_BigBoard_2026,2026-02-26,72,Chris Bell,Louisville,WR,https://www.cbssports.com/nfl/draft/news/2026-nfl-draft-top-prospects-big-board-rankings/,Bell has taken a step forward from last season and been the Cardinals' go-to receiver this fall. He's racked up a career-high 56 catches for 743 yards and six scores. He looks like a running back and runs like a corner.,72,Bell has taken a step forward from last season and been the Cardinals' go-to receiver this fall. He's racked up a career-high 56 catches for 743 yards and six scores. He looks like a running back and runs like a corner.
CBS_BigBoard_2026,2026-02-26,73,Anto Saka,Northwestern,EDGE,https://www.cbssports.com/nfl/draft/news/2026-nfl-draft-top-prospects-big-board-rankings/,"Saka truly has everything you could want to be a high-end pass rusher in the NFL. He just doesn't have much of a well-rounded game at this point. His developmental potential, though, could see him get drafted higher than even this.",73,"Saka truly has everything you could want to be a high-end pass rusher in the NFL. He just doesn't have much of a well-rounded game at this point. His developmental potential, though, could see him get drafted higher than even this."
CBS_BigBoard_2026,2026-02-26,74,Malik Muhammad,Texas,CB,https://www.cbssports.com/nfl/draft/news/2026-nfl-draft-top-prospects-big-board-rankings/,"Muhammad has barely been tested this year on the outside for the Longhorns. And when he has, not much has come of it. He's allowed 14 of 25 targets for 104 yards this season with two picks and two pass breakups.",74,"Muhammad has barely been tested this year on the outside for the Longhorns. And when he has, not much has come of it. He's allowed 14 of 25 targets for 104 yards this season with two picks and two pass breakups."
CBS_BigBoard_2026,2026-02-26,75,Ethan Burke,Texas,EDGE,https://www.cbssports.com/nfl/draft/news/2026-nfl-draft-top-prospects-big-board-rankings/,Burke has thrived in an expanded role this fall. He's a power end who's been one of the best run defenders in the country so far this season.,75,Burke has thrived in an expanded role this fall. He's a power end who's been one of the best run defenders in the country so far this season.
CBS_BigBoard_2026,2026-02-26,76,Demond Claiborne,Wake Forest,RB,https://www.cbssports.com/nfl/draft/news/2026-nfl-draft-top-prospects-big-board-rankings/,"Claiborne is pure electricity with the ball in his hands. He's right up there with Jeremiyah Love in terms of his dynamism in space, but he doesn't have quite the prowess between the tackles.",76,"Claiborne is pure electricity with the ball in his hands. He's right up there with Jeremiyah Love in terms of his dynamism in space, but he doesn't have quite the prowess between the tackles."
CBS_BigBoard_2026,2026-02-26,77,Lee Hunter,Texas Tech,DT,https://www.cbssports.com/nfl/draft/news/2026-nfl-draft-top-prospects-big-board-rankings/,Hunter is the best playmaking nose tackle in the class. He's been consistently able to track down ball carriers over the course of his career. He's just a little too up and down to have higher on this list.,77,Hunter is the best playmaking nose tackle in the class. He's been consistently able to track down ball carriers over the course of his career. He's just a little too up and down to have higher on this list.
CBS_BigBoard_2026,2026-02-26,78,Antonio Williams,Clemson,WR,https://www.cbssports.com/nfl/draft/news/2026-nfl-draft-top-prospects-big-board-rankings/,"The Clemson offense desperately missed Williams after he went down early in Week 1 with a hamstring injury. He's back now and fresh off a 10-catch, 149-yard performance against Duke . He's a rugged slot receiver who's willing to take hits over the middle of the field.",78,"The Clemson offense desperately missed Williams after he went down early in Week 1 with a hamstring injury. He's back now and fresh off a 10-catch, 149-yard performance against Duke . He's a rugged slot receiver who's willing to take hits over the middle of the field."
CBS_BigBoard_2026,2026-02-26,79,Anthony Lucas,USC,EDGE,https://www.cbssports.com/nfl/draft/news/2026-nfl-draft-top-prospects-big-board-rankings/,"Lucas is another big, long defensive end who's shown high-level flashes. His down-to-down consistency has been average, though, and he may even be better suited on the inside in the NFL.",79,"Lucas is another big, long defensive end who's shown high-level flashes. His down-to-down consistency has been average, though, and he may even be better suited on the inside in the NFL."
CBS_BigBoard_2026,2026-02-26,80,Zakee Wheatley,Penn State,S,https://www.cbssports.com/nfl/draft/news/2026-nfl-draft-top-prospects-big-board-rankings/,Wheatley has an ideal safety build with long limbs that have pop behind them. He's outstanding at coming downhill and corralling ball carriers in space.,80,Wheatley has an ideal safety build with long limbs that have pop behind them. He's outstanding at coming downhill and corralling ball carriers in space.
CBS_BigBoard_2026,2026-02-26,81,Chris Johnson,San Diego State,CB,https://www.cbssports.com/nfl/draft/news/2026-nfl-draft-top-prospects-big-board-rankings/,Johnson has been dominant so far this season. He's yielded all of 14 catches on 33 targets for 142 yards with three picks and four pass breakups. I love his hard-nosed play style and tackling ability with only one miss on 42 attempts.,81,Johnson has been dominant so far this season. He's yielded all of 14 catches on 33 targets for 142 yards with three picks and four pass breakups. I love his hard-nosed play style and tackling ability with only one miss on 42 attempts.
CBS_BigBoard_2026,2026-02-26,82,Terrance Carter Jr.,Texas Tech,TE,https://www.cbssports.com/nfl/draft/news/2026-nfl-draft-top-prospects-big-board-rankings/,"This tight end class is full of gifted athletes after the catch and Carter is right near the top of that list. Over the past two seasons, he's broken 31 tackles on 75 receptions.",82,"This tight end class is full of gifted athletes after the catch and Carter is right near the top of that list. Over the past two seasons, he's broken 31 tackles on 75 receptions."
CBS_BigBoard_2026,2026-02-26,83,Jamel Johnson,TCU,S,https://www.cbssports.com/nfl/draft/news/2026-nfl-draft-top-prospects-big-board-rankings/,Johnson has looked like a completely different player this fall than he did in his first year as a starter. His missed-tackle rate has gone from 20.7% in 2024 to 4.1% this year (on 74 attempts) and he's gone from no picks last year to four this year.,83,Johnson has looked like a completely different player this fall than he did in his first year as a starter. His missed-tackle rate has gone from 20.7% in 2024 to 4.1% this year (on 74 attempts) and he's gone from no picks last year to four this year.
CBS_BigBoard_2026,2026-02-26,84,LT Overton,Alabama,DT,https://www.cbssports.com/nfl/draft/news/2026-nfl-draft-top-prospects-big-board-rankings/,"Overton has been one of the more disappointing prospects this fall. He returned for his senior season to hopefully become a first-rounder but has taken a step backward if anything. Still, he's extremely young for a senior (turned 21 last month) and has positional versatility.",84,"Overton has been one of the more disappointing prospects this fall. He returned for his senior season to hopefully become a first-rounder but has taken a step backward if anything. Still, he's extremely young for a senior (turned 21 last month) and has positional versatility."
CBS_BigBoard_2026,2026-02-26,85,Akheem Mesidor,Miami (Fla.),EDGE,https://www.cbssports.com/nfl/draft/news/2026-nfl-draft-top-prospects-big-board-rankings/,Mesidor keeps overpowering opposing offensive linemen this season. He's had an injury-plagued career but finally looks like an NFL-caliber difference maker with 28 pressures this season.,85,Mesidor keeps overpowering opposing offensive linemen this season. He's had an injury-plagued career but finally looks like an NFL-caliber difference maker with 28 pressures this season.
CBS_BigBoard_2026,2026-02-26,86,Kevin Coleman Jr.,Missouri,WR,https://www.cbssports.com/nfl/draft/news/2026-nfl-draft-top-prospects-big-board-rankings/,"Coleman is a jitterbug slot receiver. He may be skinny, but defenders can rarely get their hands on him for it to matter. He also has some of the best hands in the draft class with a 3.1% career drop rate.",86,"Coleman is a jitterbug slot receiver. He may be skinny, but defenders can rarely get their hands on him for it to matter. He also has some of the best hands in the draft class with a 3.1% career drop rate."
CBS_BigBoard_2026,2026-02-26,87,Hero Kanu,Texas,DT,https://www.cbssports.com/nfl/draft/news/2026-nfl-draft-top-prospects-big-board-rankings/,Kanu is a breakout prospect with a ton of high-level reps on tape this fall in his first year as a starter. He's really shined in the run game where his ability to get off blocks has been top notch.,87,Kanu is a breakout prospect with a ton of high-level reps on tape this fall in his first year as a starter. He's really shined in the run game where his ability to get off blocks has been top notch.
CBS_BigBoard_2026,2026-02-26,88,Suntarine Perkins,Ole Miss,LB,https://www.cbssports.com/nfl/draft/news/2026-nfl-draft-top-prospects-big-board-rankings/,"Even if he doesn't quite play a traditional linebacker role, Perkins' ability in space as well as taking on blocks looks well suited to play the position in the NFL. You won't find too many players his size that can consistently defeat blocks the way he does.",88,"Even if he doesn't quite play a traditional linebacker role, Perkins' ability in space as well as taking on blocks looks well suited to play the position in the NFL. You won't find too many players his size that can consistently defeat blocks the way he does."
CBS_BigBoard_2026,2026-02-26,89,Jadarian Price,Notre Dame,RB,https://www.cbssports.com/nfl/draft/news/2026-nfl-draft-top-prospects-big-board-rankings/,"If you've followed Notre Dame closely the past two seasons, you'd know that despite having RB1 in Jeremiyah Love, the Irish offense hasn't taken that big of a step back when Price comes in the game. He's averaged 6.1 yards per attempt the past two seasons with 15 scores on 206 carries.",89,"If you've followed Notre Dame closely the past two seasons, you'd know that despite having RB1 in Jeremiyah Love, the Irish offense hasn't taken that big of a step back when Price comes in the game. He's averaged 6.1 yards per attempt the past two seasons with 15 scores on 206 carries."
CBS_BigBoard_2026,2026-02-26,90,Jaishawn Barham,Michigan,LB,https://www.cbssports.com/nfl/draft/news/2026-nfl-draft-top-prospects-big-board-rankings/,"I wrote linebacker here, but it's actually been Barham's tape off the edge of late that lands him on this list. He's ferocious coming downhill and already shown some innate feel for rushing the passer. He's a perfect hybrid linebacker for modern defenses.",90,"I wrote linebacker here, but it's actually been Barham's tape off the edge of late that lands him on this list. He's ferocious coming downhill and already shown some innate feel for rushing the passer. He's a perfect hybrid linebacker for modern defenses."
