source,snapshot_date,source_rank,player_name,school,position,source_url,report_text,cbs_rank,cbs_summary
CBS_BigBoard_2026,2026-02-26,91,Chase Bisontis,Texas A&M,IOL,https://www.cbssports.com/nfl/draft/news/2026-nfl-draft-top-prospects-big-board-rankings/,Bisontis has been starting since his true freshman year for the Aggies where he's developed into one of the best pass-protecting guards in the country. He's only allowed six pressures all season.,91,Bisontis has been starting since his true freshman year for the Aggies where he's developed into one of the best pass-protecting guards in the country. He's only allowed six pressures all season.
CBS_BigBoard_2026,2026-02-26,92,Red Murdock,Buffalo,LB,https://www.cbssports.com/nfl/draft/news/2026-nfl-draft-top-prospects-big-board-rankings/,Murdock stuffs the stat sheet on a weekly basis and over the weekend he made history. Murdock broke Khalil Mack's FBS forced-fumbles record with his 17th against Bowling Green . His ability to consistently punch and pry balls away from running backs will be a weapon in the league.,92,Murdock stuffs the stat sheet on a weekly basis and over the weekend he made history. Murdock broke Khalil Mack's FBS forced-fumbles record with his 17th against Bowling Green . His ability to consistently punch and pry balls away from running backs will be a weapon in the league.
CBS_BigBoard_2026,2026-02-26,93,Dontay Corleone,Cincinnati,DT,https://www.cbssports.com/nfl/draft/news/2026-nfl-draft-top-prospects-big-board-rankings/,"Corleone has never quite lived up to the potential he flashed early in his career, but it's still in there somewhere. He's got bowling-ball size with 3-technique explosiveness. That can still make an impact in the league.",93,"Corleone has never quite lived up to the potential he flashed early in his career, but it's still in there somewhere. He's got bowling-ball size with 3-technique explosiveness. That can still make an impact in the league."
CBS_BigBoard_2026,2026-02-26,94,Keith Abney II,Arizona State,CB,https://www.cbssports.com/nfl/draft/news/2026-nfl-draft-top-prospects-big-board-rankings/,Abney is yet another corner who plays the position the correct way for the modern NFL. He's an awesome tackler with no misses on 33 attempts this season and has been consistently competitive at the catch point throughout his career.,94,Abney is yet another corner who plays the position the correct way for the modern NFL. He's an awesome tackler with no misses on 33 attempts this season and has been consistently competitive at the catch point throughout his career.
CBS_BigBoard_2026,2026-02-26,95,Carter Smith,Indiana,IOL,https://www.cbssports.com/nfl/draft/news/2026-nfl-draft-top-prospects-big-board-rankings/,Smith has been the starting left tackle the past three seasons for the Hoosiers and seen his game improve by leaps and bounds over that time. He's been fueling one of the best ground games in America and only allowed four pressures this season.,95,Smith has been the starting left tackle the past three seasons for the Hoosiers and seen his game improve by leaps and bounds over that time. He's been fueling one of the best ground games in America and only allowed four pressures this season.
CBS_BigBoard_2026,2026-02-26,96,Jahiem Lawson,Clemson,EDGE,https://www.cbssports.com/nfl/draft/news/2026-nfl-draft-top-prospects-big-board-rankings/,"Lawson has been a breakout star for the Tigers and is producing almost as much as his teammate 80 spots above him on this list. He has a small frame for an edge rusher, but he uses it to his advantage by shrinking his strike zone for opposing linemen.",96,"Lawson has been a breakout star for the Tigers and is producing almost as much as his teammate 80 spots above him on this list. He has a small frame for an edge rusher, but he uses it to his advantage by shrinking his strike zone for opposing linemen."
CBS_BigBoard_2026,2026-02-26,97,Trey Zuhn III,Texas A&M,IOL,https://www.cbssports.com/nfl/draft/news/2026-nfl-draft-top-prospects-big-board-rankings/,Yet another tackle-to-guard conversion. Zuhn is already such a good pass protector at tackle that you feel confident about his ability to kick inside. He's allowed only five pressures all season at left tackle.,97,Yet another tackle-to-guard conversion. Zuhn is already such a good pass protector at tackle that you feel confident about his ability to kick inside. He's allowed only five pressures all season at left tackle.
CBS_BigBoard_2026,2026-02-26,98,AJ Harris,Penn State,CB,https://www.cbssports.com/nfl/draft/news/2026-nfl-draft-top-prospects-big-board-rankings/,"Harris hasn't had quite the season he was hoping for to vault him into the first-round mix, but he's still a very solid all-around corner. I love his ability in space as a tackler and could even see him as a slot or safety if he continues to bulk up.",98,"Harris hasn't had quite the season he was hoping for to vault him into the first-round mix, but he's still a very solid all-around corner. I love his ability in space as a tackler and could even see him as a slot or safety if he continues to bulk up."
CBS_BigBoard_2026,2026-02-26,99,Devin Moore,Florida,CB,https://www.cbssports.com/nfl/draft/news/2026-nfl-draft-top-prospects-big-board-rankings/,"At 6-foot-3, Moore is a uniquely tall corner who thrives at the line of scrimmage. He's only allowed 10 catches for 93 yards all season in his first year as a starter.",99,"At 6-foot-3, Moore is a uniquely tall corner who thrives at the line of scrimmage. He's only allowed 10 catches for 93 yards all season in his first year as a starter."
CBS_BigBoard_2026,2026-02-26,100,Clev Lubin,Louisville,EDGE,https://www.cbssports.com/nfl/draft/news/2026-nfl-draft-top-prospects-big-board-rankings/,"All Lubin has done in his two seasons of Division I football is rush the passer. He had 46 pressures last year for Coastal Carolina and now has 40 already this season for Louisville. He's not going to be much more than a third-down guy, but he could be effective at that still.",100,"All Lubin has done in his two seasons of Division I football is rush the passer. He had 46 pressures last year for Coastal Carolina and now has 40 already this season for Louisville. He's not going to be much more than a third-down guy, but he could be effective at that still."
