source,snapshot_date,source_rank,player_name,school,position,source_url,report_text,cbs_rank,cbs_summary
CBS_BigBoard_2026,2026-02-26,1,Rueben Bain Jr.,Miami (Fla.),EDGE,https://www.cbssports.com/nfl/draft/news/2026-nfl-draft-top-prospects-big-board-rankings/,"Bain is putting together the best season for a defensive end at the collegiate level since Aidan Hutchinson. Like Hutchinson, Bain isn't a cookie-cutter edge prospect. The Hurricanes defender has a defensive tackle build with shorter arms than ideal on the edge. It's no matter -- he already has 44 pressures this season.",1,"Bain is putting together the best season for a defensive end at the collegiate level since Aidan Hutchinson. Like Hutchinson, Bain isn't a cookie-cutter edge prospect. The Hurricanes defender has a defensive tackle build with shorter arms than ideal on the edge. It's no matter -- he already has 44 pressures this season."
CBS_BigBoard_2026,2026-02-26,2,Peter Woods,Clemson,DT,https://www.cbssports.com/nfl/draft/news/2026-nfl-draft-top-prospects-big-board-rankings/,Woods has been on scouting radars since he was a true freshman. He's as powerful a true junior defensive tackle as you'll see and won't turn 21 until a month before the draft. He'll be even more disruptive in the pros than he is in Clemson's defense.,2,Woods has been on scouting radars since he was a true freshman. He's as powerful a true junior defensive tackle as you'll see and won't turn 21 until a month before the draft. He'll be even more disruptive in the pros than he is in Clemson's defense.
CBS_BigBoard_2026,2026-02-26,3,Fernando Mendoza,Indiana,QB,https://www.cbssports.com/nfl/draft/news/2026-nfl-draft-top-prospects-big-board-rankings/,"The Heisman front-runner continues to play clean football with 25 touchdowns and only four interceptions. His timing, decision-making and performance under pressure are already at an NFL level. He'll be a Day 1 starter next year.",3,"The Heisman front-runner continues to play clean football with 25 touchdowns and only four interceptions. His timing, decision-making and performance under pressure are already at an NFL level. He'll be a Day 1 starter next year."
CBS_BigBoard_2026,2026-02-26,4,Jordyn Tyson,Arizona State,WR,https://www.cbssports.com/nfl/draft/news/2026-nfl-draft-top-prospects-big-board-rankings/,"Tyson is a gifted, all-around route-runner whose game fits the modern No. 1 receiver profile. He has 628 yards and eight scores this season. A lot of top-10 teams will be vying for his services.",4,"Tyson is a gifted, all-around route-runner whose game fits the modern No. 1 receiver profile. He has 628 yards and eight scores this season. A lot of top-10 teams will be vying for his services."
CBS_BigBoard_2026,2026-02-26,5,Caleb Downs,Ohio State,S,https://www.cbssports.com/nfl/draft/news/2026-nfl-draft-top-prospects-big-board-rankings/,"In a relatively down class, don't be surprised if a safety ends up in the top 10 for the first time since 2017. Downs is the perfect player for the positionless-defender role that's growing in the NFL .",5,"In a relatively down class, don't be surprised if a safety ends up in the top 10 for the first time since 2017. Downs is the perfect player for the positionless-defender role that's growing in the NFL ."
CBS_BigBoard_2026,2026-02-26,6,Carnell Tate,Ohio State,WR,https://www.cbssports.com/nfl/draft/news/2026-nfl-draft-top-prospects-big-board-rankings/,Tate is one of the biggest risers in the class this fall. His combination of efficiency and explosiveness is exceedingly rare. He has caught 84.8% of his targets while averaging 18.2 yards per reception. His explosiveness and ball skills are well worth a top-10 pick.,6,Tate is one of the biggest risers in the class this fall. His combination of efficiency and explosiveness is exceedingly rare. He has caught 84.8% of his targets while averaging 18.2 yards per reception. His explosiveness and ball skills are well worth a top-10 pick.
CBS_BigBoard_2026,2026-02-26,7,Jermod McCoy,Tennessee,CB,https://www.cbssports.com/nfl/draft/news/2026-nfl-draft-top-prospects-big-board-rankings/,McCoy has yet to play this season while recovering from a torn ACL in January. The fact he remains a top-10 player here shows how good his sophomore tape was. He could pull an Antonio Cromartie and still go in Round 1 without playing his final year.,7,McCoy has yet to play this season while recovering from a torn ACL in January. The fact he remains a top-10 player here shows how good his sophomore tape was. He could pull an Antonio Cromartie and still go in Round 1 without playing his final year.
CBS_BigBoard_2026,2026-02-26,8,Francis Mauigoa,Miami (Fla.),OT,https://www.cbssports.com/nfl/draft/news/2026-nfl-draft-top-prospects-big-board-rankings/,Mauigoa is a brutish tackle who can punish double-teams and stonewall bull-rushes. He's been starting on the right side since his true freshman year and has only gotten better.,8,Mauigoa is a brutish tackle who can punish double-teams and stonewall bull-rushes. He's been starting on the right side since his true freshman year and has only gotten better.
CBS_BigBoard_2026,2026-02-26,9,Spencer Fano,Utah,IOL,https://www.cbssports.com/nfl/draft/news/2026-nfl-draft-top-prospects-big-board-rankings/,"While Fano plays right tackle, he projects as a guard. He's the best zone blocker in the class and still well worth a top-10 pick even if kicked inside.",9,"While Fano plays right tackle, he projects as a guard. He's the best zone blocker in the class and still well worth a top-10 pick even if kicked inside."
CBS_BigBoard_2026,2026-02-26,10,Arvell Reese,Ohio State,LB,https://www.cbssports.com/nfl/draft/news/2026-nfl-draft-top-prospects-big-board-rankings/,"Yet another Buckeye in the top 10. It's time to drop the linebacker tag and call him what he'll be in the NFL : a pass rusher. You don't waste someone with his size, burst and length at the second level. He has 22 pressures on 71 pass-rush snaps this season.",10,"Yet another Buckeye in the top 10. It's time to drop the linebacker tag and call him what he'll be in the NFL : a pass rusher. You don't waste someone with his size, burst and length at the second level. He has 22 pressures on 71 pass-rush snaps this season."
CBS_BigBoard_2026,2026-02-26,11,Keldric Faulk,Auburn,EDGE,https://www.cbssports.com/nfl/draft/news/2026-nfl-draft-top-prospects-big-board-rankings/,"I listed Faulk at edge because that's where he plays now, but athletes his size are more and more often moving inside in the NFL . He's long and twitchy with some special run-game reps already.",11,"I listed Faulk at edge because that's where he plays now, but athletes his size are more and more often moving inside in the NFL . He's long and twitchy with some special run-game reps already."
CBS_BigBoard_2026,2026-02-26,12,Ty Simpson,Alabama,QB,https://www.cbssports.com/nfl/draft/news/2026-nfl-draft-top-prospects-big-board-rankings/,"After a rocky first start against Florida State , Simpson has passed every test since. No moment has seemed too big for him as he looks like a veteran despite being in his first year as a starter. He has solid all-around tools and always looks in command.",12,"After a rocky first start against Florida State , Simpson has passed every test since. No moment has seemed too big for him as he looks like a veteran despite being in his first year as a starter. He has solid all-around tools and always looks in command."
CBS_BigBoard_2026,2026-02-26,13,Dante Moore,Oregon,QB,https://www.cbssports.com/nfl/draft/news/2026-nfl-draft-top-prospects-big-board-rankings/,"Moore has shown his inexperience a bit lately, but there's still a lot to like on his tape. The question is whether he declares with two more years of eligibility after this season.",13,"Moore has shown his inexperience a bit lately, but there's still a lot to like on his tape. The question is whether he declares with two more years of eligibility after this season."
CBS_BigBoard_2026,2026-02-26,14,Jeremiyah Love,Notre Dame,RB,https://www.cbssports.com/nfl/draft/news/2026-nfl-draft-top-prospects-big-board-rankings/,"Love is a big play waiting to happen. His quick feet, elite acceleration and breakaway speed are exactly what NFL teams want. He's racked up 28 touchdowns on 303 carries the past two seasons.",14,"Love is a big play waiting to happen. His quick feet, elite acceleration and breakaway speed are exactly what NFL teams want. He's racked up 28 touchdowns on 303 carries the past two seasons."
CBS_BigBoard_2026,2026-02-26,15,T.J. Parker,Clemson,EDGE,https://www.cbssports.com/nfl/draft/news/2026-nfl-draft-top-prospects-big-board-rankings/,"Parker is a solid, if unspectacular, edge defender who has been relatively quiet compared with expectations. He was a true freshman starter in 2023 with 35 pressures, but is on pace for fewer this year with only 21 so far.",15,"Parker is a solid, if unspectacular, edge defender who has been relatively quiet compared with expectations. He was a true freshman starter in 2023 with 35 pressures, but is on pace for fewer this year with only 21 so far."
CBS_BigBoard_2026,2026-02-26,16,Olaivavega Ioane,Penn State,IOL,https://www.cbssports.com/nfl/draft/news/2026-nfl-draft-top-prospects-big-board-rankings/,Ioane has been the lone bright spot on a reeling Penn State team. He has allowed only one pressure all season and is the top true guard in the class.,16,Ioane has been the lone bright spot on a reeling Penn State team. He has allowed only one pressure all season and is the top true guard in the class.
CBS_BigBoard_2026,2026-02-26,17,Makai Lemon,USC,WR,https://www.cbssports.com/nfl/draft/news/2026-nfl-draft-top-prospects-big-board-rankings/,Lemon is a ready-made slot receiver averaging nearly 100 yards per game. He doesn't drop passes and consistently finds space over the middle.,17,Lemon is a ready-made slot receiver averaging nearly 100 yards per game. He doesn't drop passes and consistently finds space over the middle.
CBS_BigBoard_2026,2026-02-26,18,Caleb Lomu,Utah,OT,https://www.cbssports.com/nfl/draft/news/2026-nfl-draft-top-prospects-big-board-rankings/,"Lomu is no sure thing to declare as a third-year player who still needs to improve his strength. If he does, a team is getting a gifted mover who uses his hands in pass protection as well as anyone in the class.",18,"Lomu is no sure thing to declare as a third-year player who still needs to improve his strength. If he does, a team is getting a gifted mover who uses his hands in pass protection as well as anyone in the class."
CBS_BigBoard_2026,2026-02-26,19,Avieon Terrell,Clemson,CB,https://www.cbssports.com/nfl/draft/news/2026-nfl-draft-top-prospects-big-board-rankings/,"Terrell may not look imposing at 180 pounds, but he plays extremely physical football. He has forced six fumbles over the past two seasons and has 14 pass breakups.",19,"Terrell may not look imposing at 180 pounds, but he plays extremely physical football. He has forced six fumbles over the past two seasons and has 14 pass breakups."
CBS_BigBoard_2026,2026-02-26,20,Chris Brazzell II,Tennessee,WR,https://www.cbssports.com/nfl/draft/news/2026-nfl-draft-top-prospects-big-board-rankings/,"Brazzell is a unique deep threat at 6-foot-5 and 200 pounds. He has real vertical speed and the ability to ""Moss"" cornerbacks at the catch point. He may be a bit of a one-trick pony, but it's a valuable trick.",20,"Brazzell is a unique deep threat at 6-foot-5 and 200 pounds. He has real vertical speed and the ability to ""Moss"" cornerbacks at the catch point. He may be a bit of a one-trick pony, but it's a valuable trick."
CBS_BigBoard_2026,2026-02-26,21,Kadyn Proctor,Alabama,IOL,https://www.cbssports.com/nfl/draft/news/2026-nfl-draft-top-prospects-big-board-rankings/,Proctor has shown some limitations in pass protection this year and is most likely going to kick inside at the next level outside of a few schemes. You're still getting the single best lineman at moving people against their will in the run game.,21,Proctor has shown some limitations in pass protection this year and is most likely going to kick inside at the next level outside of a few schemes. You're still getting the single best lineman at moving people against their will in the run game.
CBS_BigBoard_2026,2026-02-26,22,Emmanuel Pregnon,Oregon,IOL,https://www.cbssports.com/nfl/draft/news/2026-nfl-draft-top-prospects-big-board-rankings/,Pregnon has been lights-out all season for the Ducks after transferring from USC. He has allowed only two pressures after yielding 18 a year ago. You won't find many offensive linemen as physically put together as Pregnon.,22,Pregnon has been lights-out all season for the Ducks after transferring from USC. He has allowed only two pressures after yielding 18 a year ago. You won't find many offensive linemen as physically put together as Pregnon.
CBS_BigBoard_2026,2026-02-26,23,Matayo Uiagalelei,Oregon,EDGE,https://www.cbssports.com/nfl/draft/news/2026-nfl-draft-top-prospects-big-board-rankings/,"One of the youngest players in the class, Uiagalelei won't turn 21 until next summer. The former five-star recruit has improved every year and already has 25 pressures this season.",23,"One of the youngest players in the class, Uiagalelei won't turn 21 until next summer. The former five-star recruit has improved every year and already has 25 pressures this season."
CBS_BigBoard_2026,2026-02-26,24,CJ Allen,Georgia,LB,https://www.cbssports.com/nfl/draft/news/2026-nfl-draft-top-prospects-big-board-rankings/,"Allen is an enforcer at the second level. Despite relatively modest size, he consistently sends offensive linemen backward. He also rarely misses tackles, with just a 6.8% career miss rate.",24,"Allen is an enforcer at the second level. Despite relatively modest size, he consistently sends offensive linemen backward. He also rarely misses tackles, with just a 6.8% career miss rate."
CBS_BigBoard_2026,2026-02-26,25,Cashius Howell,Texas A&M,EDGE,https://www.cbssports.com/nfl/draft/news/2026-nfl-draft-top-prospects-big-board-rankings/,Howell is the best pure pass rusher in the class with a full array of moves. The only thing holding him back from being a sure-fire first-rounder is his lack of size and length.,25,Howell is the best pure pass rusher in the class with a full array of moves. The only thing holding him back from being a sure-fire first-rounder is his lack of size and length.
CBS_BigBoard_2026,2026-02-26,26,David Bailey,Texas Tech,EDGE,https://www.cbssports.com/nfl/draft/news/2026-nfl-draft-top-prospects-big-board-rankings/,"Bailey has elite juice off the edge. He's racked up more pressures and sacks than anyone in college football this season. While he's still a little too reliant on raw athleticism, he has shown real development in the run game this year.",26,"Bailey has elite juice off the edge. He's racked up more pressures and sacks than anyone in college football this season. While he's still a little too reliant on raw athleticism, he has shown real development in the run game this year."
CBS_BigBoard_2026,2026-02-26,27,Max Klare,Ohio State,TE,https://www.cbssports.com/nfl/draft/news/2026-nfl-draft-top-prospects-big-board-rankings/,"Klare's production has suffered with so many mouths to feed in the Buckeyes' offense, but the tape still shows the best route-running tight end in the class. He has a natural feel for separating, even if he has only 210 yards this season.",27,"Klare's production has suffered with so many mouths to feed in the Buckeyes' offense, but the tape still shows the best route-running tight end in the class. He has a natural feel for separating, even if he has only 210 yards this season."
CBS_BigBoard_2026,2026-02-26,28,Jake Golday,Cincinnati,LB,https://www.cbssports.com/nfl/draft/news/2026-nfl-draft-top-prospects-big-board-rankings/,Golday has the rare combination of edge-rusher size and safety-level athleticism. He can do it all at the second level.,28,Golday has the rare combination of edge-rusher size and safety-level athleticism. He can do it all at the second level.
CBS_BigBoard_2026,2026-02-26,29,Joshua Josephs,Tennessee,EDGE,https://www.cbssports.com/nfl/draft/news/2026-nfl-draft-top-prospects-big-board-rankings/,"Josephs is a long-armed edge rusher who wins with length. He may be on the lighter side, but he can still set a firm edge. He's thriving with a career-high 26 pressures this season.",29,"Josephs is a long-armed edge rusher who wins with length. He may be on the lighter side, but he can still set a firm edge. He's thriving with a career-high 26 pressures this season."
CBS_BigBoard_2026,2026-02-26,30,Sonny Styles,Ohio State,LB,https://www.cbssports.com/nfl/draft/news/2026-nfl-draft-top-prospects-big-board-rankings/,Styles is a former safety who kept getting bigger -- and somehow more athletic. His sideline-to-sideline speed is the best in the class.,30,Styles is a former safety who kept getting bigger -- and somehow more athletic. His sideline-to-sideline speed is the best in the class.
CBS_BigBoard_2026,2026-02-26,31,Trevor Goosby,Texas,OT,https://www.cbssports.com/nfl/draft/news/2026-nfl-draft-top-prospects-big-board-rankings/,"Goosby has a more prototypical tackle build and athletic profile than either of the Longhorns' tackles drafted last spring. He moves well and can get out in space. He's still raw in his first year as a starter, but a weaker tackle class may push him to declare early.",31,"Goosby has a more prototypical tackle build and athletic profile than either of the Longhorns' tackles drafted last spring. He moves well and can get out in space. He's still raw in his first year as a starter, but a weaker tackle class may push him to declare early."
CBS_BigBoard_2026,2026-02-26,32,Eric Singleton Jr.,Auburn,WR,https://www.cbssports.com/nfl/draft/news/2026-nfl-draft-top-prospects-big-board-rankings/,"Singleton didn't land in the most favorable quarterback situation after transferring from Georgia Tech , but the tape still shows an explosive all-around athlete. His deep-threat ability has been muted with only a 5.6-yard average depth of target.",32,"Singleton didn't land in the most favorable quarterback situation after transferring from Georgia Tech , but the tape still shows an explosive all-around athlete. His deep-threat ability has been muted with only a 5.6-yard average depth of target."
CBS_BigBoard_2026,2026-02-26,33,Emmanuel McNeil-Warren,Toledo,S,https://www.cbssports.com/nfl/draft/news/2026-nfl-draft-top-prospects-big-board-rankings/,McNeil-Warren is the best box safety in the class. His consistent impact around the line of scrimmage will translate quickly. I love that he's got a knack for forcing fumbles with 11 in his career.,33,McNeil-Warren is the best box safety in the class. His consistent impact around the line of scrimmage will translate quickly. I love that he's got a knack for forcing fumbles with 11 in his career.
CBS_BigBoard_2026,2026-02-26,34,Kayden McDonald,Ohio State,DT,https://www.cbssports.com/nfl/draft/news/2026-nfl-draft-top-prospects-big-board-rankings/,"McDonald is the best run-stuffer in the class. Whether one-on-one or against double teams, you aren't moving him. You're not getting much as a pass rusher, but he's a sure thing vs. the run.",34,"McDonald is the best run-stuffer in the class. Whether one-on-one or against double teams, you aren't moving him. You're not getting much as a pass rusher, but he's a sure thing vs. the run."
CBS_BigBoard_2026,2026-02-26,35,Omar Cooper Jr.,Indiana,WR,https://www.cbssports.com/nfl/draft/news/2026-nfl-draft-top-prospects-big-board-rankings/,Cooper continues to create yards after the catch in Indiana's offense. He leads the FBS with 17 broken tackles on 46 catches and has a running back-like build that should translate to the NFL .,35,Cooper continues to create yards after the catch in Indiana's offense. He leads the FBS with 17 broken tackles on 46 catches and has a running back-like build that should translate to the NFL .
CBS_BigBoard_2026,2026-02-26,36,Denzel Boston,Washington,WR,https://www.cbssports.com/nfl/draft/news/2026-nfl-draft-top-prospects-big-board-rankings/,Boston is a big-bodied outside receiver who can still get down the field. He already has seven deep receptions this season and can win at all three levels.,36,Boston is a big-bodied outside receiver who can still get down the field. He already has seven deep receptions this season and can win at all three levels.
CBS_BigBoard_2026,2026-02-26,37,Michael Trigg,Baylor,TE,https://www.cbssports.com/nfl/draft/news/2026-nfl-draft-top-prospects-big-board-rankings/,"Trigg has been the most productive tight end in the country with 40 catches for 607 yards. His highlight reel is absurd, and his catch radius is special with a 7-foot wingspan.",37,"Trigg has been the most productive tight end in the country with 40 catches for 607 yards. His highlight reel is absurd, and his catch radius is special with a 7-foot wingspan."
CBS_BigBoard_2026,2026-02-26,38,Mansoor Delane,LSU,CB,https://www.cbssports.com/nfl/draft/news/2026-nfl-draft-top-prospects-big-board-rankings/,"Delane isn't a high-end athlete, but no one is playing the position better right now. He has allowed only eight catches on 25 targets this season.",38,"Delane isn't a high-end athlete, but no one is playing the position better right now. He has allowed only eight catches on 25 targets this season."
CBS_BigBoard_2026,2026-02-26,39,Anthony Hill Jr.,Texas,LB,https://www.cbssports.com/nfl/draft/news/2026-nfl-draft-top-prospects-big-board-rankings/,Hill moves incredibly well for a nearly 240-pound linebacker and has only three missed tackles on 70 attempts this season. There aren't many holes to poke in his game.,39,Hill moves incredibly well for a nearly 240-pound linebacker and has only three missed tackles on 70 attempts this season. There aren't many holes to poke in his game.
CBS_BigBoard_2026,2026-02-26,40,Kade Pieper,Iowa,IOL,https://www.cbssports.com/nfl/draft/news/2026-nfl-draft-top-prospects-big-board-rankings/,"Pieper is almost certain to return to school for a couple reasons. He's only in his first year as a starter, and inexperienced linemen rarely declare early. He's also playing out of position at guard -- his NFL future is at center. Still, he's the most athletic lineman in college football .",40,"Pieper is almost certain to return to school for a couple reasons. He's only in his first year as a starter, and inexperienced linemen rarely declare early. He's also playing out of position at guard -- his NFL future is at center. Still, he's the most athletic lineman in college football ."
CBS_BigBoard_2026,2026-02-26,41,Colton Hood,Tennessee,CB,https://www.cbssports.com/nfl/draft/news/2026-nfl-draft-top-prospects-big-board-rankings/,"Even with Jermod McCoy out, the Volunteers have still had a shutdown outside corner. Hood has allowed 17 receptions on 37 targets for 196 yards after transferring from Colorado .",41,"Even with Jermod McCoy out, the Volunteers have still had a shutdown outside corner. Hood has allowed 17 receptions on 37 targets for 196 yards after transferring from Colorado ."
CBS_BigBoard_2026,2026-02-26,42,Quincy Rhodes Jr.,Arkansas,EDGE,https://www.cbssports.com/nfl/draft/news/2026-nfl-draft-top-prospects-big-board-rankings/,"Rhodes has been a breakout star for the Razorbacks. The 6-foot-6, 275-pounder has the ideal build to be a versatile NFL weapon. The question is whether he'll declare after just one season as a starter.",42,"Rhodes has been a breakout star for the Razorbacks. The 6-foot-6, 275-pounder has the ideal build to be a versatile NFL weapon. The question is whether he'll declare after just one season as a starter."
CBS_BigBoard_2026,2026-02-26,43,Romello Height,Texas Tech,EDGE,https://www.cbssports.com/nfl/draft/news/2026-nfl-draft-top-prospects-big-board-rankings/,"Height may be light and a bit older, but he can rush the passer. He plays such a tenacious brand of football despite being under 240 pounds that I can't help but root for him.",43,"Height may be light and a bit older, but he can rush the passer. He plays such a tenacious brand of football despite being under 240 pounds that I can't help but root for him."
CBS_BigBoard_2026,2026-02-26,44,Ja'Kobi Lane,USC,WR,https://www.cbssports.com/nfl/draft/news/2026-nfl-draft-top-prospects-big-board-rankings/,"Lane has a basketball-type frame and uses it well, especially in the red zone. Seventeen of his 76 career catches have gone for touchdowns.",44,"Lane has a basketball-type frame and uses it well, especially in the red zone. Seventeen of his 76 career catches have gone for touchdowns."
CBS_BigBoard_2026,2026-02-26,45,KC Concepcion,Texas A&M,WR,https://www.cbssports.com/nfl/draft/news/2026-nfl-draft-top-prospects-big-board-rankings/,Concepcion is a nimble route-runner with elite start-stop quickness. His hands are the concern -- his career drop rate sits at 9.3%.,45,Concepcion is a nimble route-runner with elite start-stop quickness. His hands are the concern -- his career drop rate sits at 9.3%.
CBS_BigBoard_2026,2026-02-26,46,D'Angelo Ponds,Indiana,CB,https://www.cbssports.com/nfl/draft/news/2026-nfl-draft-top-prospects-big-board-rankings/,"I held out waiting for Ponds to get exposed as long as I could before including him in my top-50. That's because 5-foot-9, 173-pound corners aren't supposed to be able to lock down receivers the way he does. He just keeps doing it, though, with only 14 catches allowed on 29 targets for 101 yards this season.",46,"I held out waiting for Ponds to get exposed as long as I could before including him in my top-50. That's because 5-foot-9, 173-pound corners aren't supposed to be able to lock down receivers the way he does. He just keeps doing it, though, with only 14 catches allowed on 29 targets for 101 yards this season."
