slug,player_name,public_report_summary,public_why_he_wins,public_primary_concerns,public_film_notes,public_role_projection,seo_description,private_owner_notes
cole-payton,Cole Payton,"Cole Payton (QB, North Dakota State) projects as a Round 4-5 talent with his cleanest NFL path coming as a dynamic spread starter in Spread/RPO movement-launch attack. The current model grade sits at 78.04, with the board currently slotting him at No. 149. developmental contributor profile; wins with timing and structure while retaining off-script creation.","- Usage fit: Dynamic spread starter within Spread/RPO movement-launch attack.
- Film translation comes from timing/processing: ID leverage pre-snap, hold structure from the pocket, and create only when structure breaks.
- QB style lens: high-efficiency anticipation distributor; wins by seeing windows early and triggering on time from structure.
- Model + film note: developmental contributor profile; wins with timing and structure while retaining off-script creation.
- Scout-logged strength indicators: >.","- Scouting concern to verify: >.
- Missing ESPN QBR context increases uncertainty in down-to-down efficiency under pressure.
- Missing EPA/play context limits separation of explosive production versus sustainable drive efficiency.",,"Best early team fit: LV. Expected early deployment: Dynamic spread starter in Spread/RPO movement-launch attack. Early value comes from rhythm passing on early downs, controlled aggression on explosives, and situational command on third down or in two-minute. Historical combine comp: Joe Reed (2020), athletic-profile match 88.1%.","Cole Payton QB scouting report, traits, role fit, concerns, and NFL Draft projection.",
dezhaun-stribling,De'Zhaun Stribling,"De'Zhaun Stribling (WR, Mississippi) projects as a Round 4-5 talent with his cleanest NFL path coming as a alignment-flexible target earner in Spread vertical / spacing menu. The current model grade sits at 77.67, with the board currently slotting him at No. 150. developmental contributor profile; creates separation and finishes at the catch point.","- Usage fit: Alignment-flexible target earner within Spread vertical / spacing menu.
- Film translation comes from route craft: release with a plan, manipulate leverage in stems, and separate at breakpoints with late hands.
- Receiver style lens: separation is driven by vertical speed stress, route-volume earning.
- Model + film note: developmental contributor profile; creates separation and finishes at the catch point.","- Target-earning rate (13.1% share) suggests volume translation risk against NFL coverage.
- Release plan versus press corners has to hold up when defenders force timing disruption at the line.
- Route pacing and stem detail must stay efficient versus complex leverage rotations and trap coverages.",,"Best early team fit: CLE. Expected early deployment: Alignment-flexible target earner in Spread vertical / spacing menu. Early value comes from leverage-based separation, coverage-ID chemistry with the quarterback, and finish strength through contact. Historical combine comp: Toney Clemons (2012), athletic-profile match 96.66%.","De'Zhaun Stribling WR scouting report, traits, role fit, concerns, and NFL Draft projection.",
logan-jones,Logan Jones,"Logan Jones (IOL, Iowa) projects as a Round 4-5 talent with his cleanest NFL path coming as a starter with interior pocket-control value in Inside-zone / gap hybrid. The current model grade sits at 77.37, with the board currently slotting him at No. 151. developmental contributor profile; stabilizes interior pocket depth and run fits.","- Usage fit: Starter with interior pocket-control value within Inside-zone / gap hybrid.
- Film translation comes from interior control: hand placement, leverage, and communication to pass off stunts without leakage.
- Model + film note: developmental contributor profile; stabilizes interior pocket depth and run fits.","- Interior anchor mass is light versus NFL power fronts, creating pocket-depth stress risk.
- Interior communication versus games/stunts must be consistent to protect pocket depth for the QB.
- Leverage and hand placement must hold late in reps against stronger NFL interior rushers.",,"Best early team fit: DET. Expected early deployment: Starter with interior pocket-control value in Inside-zone / gap hybrid. Early value comes from interior pocket integrity, line-call chemistry, and efficient climb timing in zone and gap runs. Historical combine comp: Tyler Linderbaum (2022), athletic-profile match 91.82%.","Logan Jones IOL scouting report, traits, role fit, concerns, and NFL Draft projection.",
albert-regis,Albert Regis,"Albert Regis (DT, Texas A&M Aggies) projects as a Round 4-5 talent with his cleanest NFL path coming as a double-team absorbing anchor in Odd-front shade / early-down interior fit. The current model grade sits at 77.64, with the board currently slotting him at No. 152. developmental contributor profile; controls interior gaps and collapses pocket.","- Usage fit: Double-team absorbing anchor within Odd-front shade / early-down interior fit.
- Film translation comes from disruption and block control: strike timing, gap integrity, and pocket compression on long downs.
- Model + film note: developmental contributor profile; controls interior gaps and collapses pocket.","- Interior mass profile is light for consistent NFL anchor control on early downs.
- PFF grade 72.8 suggests current performance volatility that needs film-confirmed cleanup.",,"Best early team fit: BUF. Expected early deployment: Double-team absorbing anchor in Odd-front shade / early-down interior fit. Early value comes from early-down run control plus enough third-down pocket push to keep fronts multiple. Historical combine comp: Mike Daniels (2012), athletic-profile match 93.13%.","Albert Regis DT scouting report, traits, role fit, concerns, and NFL Draft projection.",
armaj-reed-adams,Ar'maj Reed-Adams,"Ar'maj Reed-Adams (IOL, Texas A&M) projects as a Round 4-5 talent with his cleanest NFL path coming as a starter with interior pocket-control value in Inside-zone / gap hybrid. The current model grade sits at 77.47, with the board currently slotting him at No. 153. developmental contributor profile; stabilizes interior pocket depth and run fits.","- Usage fit: Starter with interior pocket-control value within Inside-zone / gap hybrid.
- Film translation comes from interior control: hand placement, leverage, and communication to pass off stunts without leakage.
- Model + film note: developmental contributor profile; stabilizes interior pocket depth and run fits.","- PFF grade 69.1 suggests current performance volatility that needs film-confirmed cleanup.
- Interior communication versus games/stunts must be consistent to protect pocket depth for the QB.
- Leverage and hand placement must hold late in reps against stronger NFL interior rushers.",,"Best early team fit: DET. Expected early deployment: Starter with interior pocket-control value in Inside-zone / gap hybrid. Early value comes from interior pocket integrity, line-call chemistry, and efficient climb timing in zone and gap runs. Historical combine comp: Ben Brown (2022), athletic-profile match 95.74%.","Ar'maj Reed-Adams IOL scouting report, traits, role fit, concerns, and NFL Draft projection.",
parker-brailsford,Parker Brailsford,"Parker Brailsford (IOL, Alabama) projects as a Round 4-5 talent with his cleanest NFL path coming as a starter with interior pocket-control value in Inside-zone / gap hybrid. The current model grade sits at 77.47, with the board currently slotting him at No. 154. developmental contributor profile; stabilizes interior pocket depth and run fits.","- Usage fit: Starter with interior pocket-control value within Inside-zone / gap hybrid.
- Film translation comes from interior control: hand placement, leverage, and communication to pass off stunts without leakage.
- Model + film note: developmental contributor profile; stabilizes interior pocket depth and run fits.","- Interior anchor mass is light versus NFL power fronts, creating pocket-depth stress risk.
- PFF grade 65.6 suggests current performance volatility that needs film-confirmed cleanup.",,"Best early team fit: DET. Expected early deployment: Starter with interior pocket-control value in Inside-zone / gap hybrid. Early value comes from interior pocket integrity, line-call chemistry, and efficient climb timing in zone and gap runs. Historical combine comp: Adam Gettis (2012), athletic-profile match 89.05%.","Parker Brailsford IOL scouting report, traits, role fit, concerns, and NFL Draft projection.",
jager-burton,Jager Burton,"Jager Burton (IOL, Kentucky) projects as a Round 4-5 talent with his cleanest NFL path coming as a starter with interior pocket-control value in Inside-zone / gap hybrid. The current model grade sits at 77.47, with the board currently slotting him at No. 155. developmental contributor profile; stabilizes interior pocket depth and run fits.","- Usage fit: Starter with interior pocket-control value within Inside-zone / gap hybrid.
- Film translation comes from interior control: hand placement, leverage, and communication to pass off stunts without leakage.
- Model + film note: developmental contributor profile; stabilizes interior pocket depth and run fits.","- PFF grade 71.3 suggests current performance volatility that needs film-confirmed cleanup.
- Interior communication versus games/stunts must be consistent to protect pocket depth for the QB.
- Leverage and hand placement must hold late in reps against stronger NFL interior rushers.",,"Best early team fit: DET. Expected early deployment: Starter with interior pocket-control value in Inside-zone / gap hybrid. Early value comes from interior pocket integrity, line-call chemistry, and efficient climb timing in zone and gap runs. Historical combine comp: Tyler Biadasz (2020), athletic-profile match 96.13%.","Jager Burton IOL scouting report, traits, role fit, concerns, and NFL Draft projection.",
joe-royer,Joe Royer,"Joe Royer (TE, Cincinnati Bearcats) projects as a Round 4-5 talent with his cleanest NFL path coming as a y-tight end with chain-moving value in Play-action attach / boot complement. The current model grade sits at 77.43, with the board currently slotting him at No. 156. developmental contributor profile; projects as a mismatch in multiple alignments.","- Usage fit: Y-tight end with chain-moving value within Play-action attach / boot complement.
- Film translation comes from dual-phase utility: route detail vs coverage plus in-line toughness that keeps personnel groupings flexible.
- Receiver style lens: evaluate from snap to catch — release plan, break mechanics, edge attack, and contact-point finish — to separate true NFL translatability.
- Model + film note: developmental contributor profile; projects as a mismatch in multiple alignments.","- Target-earning rate (11.0% share) suggests volume translation risk against NFL coverage.
- PFF grade 59.8 suggests current performance volatility that needs film-confirmed cleanup.",,"Best early team fit: LAC. Expected early deployment: Y-tight end with chain-moving value in Play-action attach / boot complement. Early value comes from personnel flexibility, where the same player can stress seams and still survive attached to the formation. Historical combine comp: Durham Smythe (2018), athletic-profile match 90.01%.","Joe Royer TE scouting report, traits, role fit, concerns, and NFL Draft projection.",
dj-campbell,DJ Campbell,"DJ Campbell (IOL, Texas Longhorns) projects as a Round 4-5 talent with his cleanest NFL path coming as a starter with interior pocket-control value in Inside-zone / gap hybrid. The current model grade sits at 77.47, with the board currently slotting him at No. 157. developmental contributor profile; stabilizes interior pocket depth and run fits.","- Usage fit: Starter with interior pocket-control value within Inside-zone / gap hybrid.
- Film translation comes from interior control: hand placement, leverage, and communication to pass off stunts without leakage.
- Model + film note: developmental contributor profile; stabilizes interior pocket depth and run fits.","- PFF grade 70.9 suggests current performance volatility that needs film-confirmed cleanup.
- Interior communication versus games/stunts must be consistent to protect pocket depth for the QB.
- Leverage and hand placement must hold late in reps against stronger NFL interior rushers.",,"Best early team fit: DET. Expected early deployment: Starter with interior pocket-control value in Inside-zone / gap hybrid. Early value comes from interior pocket integrity, line-call chemistry, and efficient climb timing in zone and gap runs. Historical combine comp: Hugh Thornton (2013), athletic-profile match 93.31%.","DJ Campbell IOL scouting report, traits, role fit, concerns, and NFL Draft projection.",
cade-klubnik,Cade Klubnik,"Cade Klubnik (QB, Clemson) projects as a Round 4-5 talent with his cleanest NFL path coming as a developmental live-arm creator in Movement-passer package. The current model grade sits at 77.54, with the board currently slotting him at No. 158. developmental contributor profile; wins with timing and structure while retaining off-script creation.","- Usage fit: Developmental live-arm creator within Movement-passer package.
- Film translation comes from timing/processing: ID leverage pre-snap, hold structure from the pocket, and create only when structure breaks.
- QB style lens: high-efficiency anticipation distributor; wins by seeing windows early and triggering on time from structure.
- Model + film note: developmental contributor profile; wins with timing and structure while retaining off-script creation.","- Pocket disruption response must stay on schedule; drifting off platform creates NFL turnover windows.
- Third-down decision speed versus disguised coverage is the key separator between starter and backup outcomes.",,"Best early team fit: LV. Expected early deployment: Developmental live-arm creator in Movement-passer package. Early value comes from rhythm passing on early downs, controlled aggression on explosives, and situational command on third down or in two-minute. Historical combine comp: Hutson Mason (2015), athletic-profile match 96.92%.","Cade Klubnik QB scouting report, traits, role fit, concerns, and NFL Draft projection.",
roman-hemby,Roman Hemby,"Roman Hemby (RB, Indiana) projects as a Round 4-5 talent with his cleanest NFL path coming as a primary committee back with passing-down utility in Wide-zone committee. The current model grade sits at 78.40, with the board currently slotting him at No. 159. developmental contributor profile; creates hidden yards and stays on schedule.","- Usage fit: Primary committee back with passing-down utility within Wide-zone committee.
- Film translation comes from vision plus contact balance: press tracks, force linebacker displacement, then accelerate through daylight.
- Model + film note: developmental contributor profile; creates hidden yards and stays on schedule.","- Lack of explosive-run creation (10.0% explosive rate) narrows home-run ceiling.
- Early-down production must be paired with dependable pass-protection reps to hold three-down value.
- Contact balance has to translate against tighter NFL pursuit angles, not just open-lane college looks.",,"Best early team fit: DAL. Expected early deployment: Primary committee back with passing-down utility in Wide-zone committee. Early value comes from box-count recognition, efficient run tracks, and enough receiving utility to stay on the field in sub packages. Historical combine comp: Kory Sheets (2009), athletic-profile match 98.07%.","Roman Hemby RB scouting report, traits, role fit, concerns, and NFL Draft projection.",
jalen-farmer,Jalen Farmer,"Jalen Farmer (IOL, Kentucky) projects as a Round 4-5 talent with his cleanest NFL path coming as a starter with interior pocket-control value in Inside-zone / gap hybrid. The current model grade sits at 77.47, with the board currently slotting him at No. 160. developmental contributor profile; stabilizes interior pocket depth and run fits.","- Usage fit: Starter with interior pocket-control value within Inside-zone / gap hybrid.
- Film translation comes from interior control: hand placement, leverage, and communication to pass off stunts without leakage.
- Model + film note: developmental contributor profile; stabilizes interior pocket depth and run fits.","- PFF grade 69.8 suggests current performance volatility that needs film-confirmed cleanup.
- Interior communication versus games/stunts must be consistent to protect pocket depth for the QB.
- Leverage and hand placement must hold late in reps against stronger NFL interior rushers.",,"Best early team fit: DET. Expected early deployment: Starter with interior pocket-control value in Inside-zone / gap hybrid. Early value comes from interior pocket integrity, line-call chemistry, and efficient climb timing in zone and gap runs. Historical combine comp: Jon Dietzen (2021), athletic-profile match 94.8%.","Jalen Farmer IOL scouting report, traits, role fit, concerns, and NFL Draft projection.",
lorenzo-styles-jr,Lorenzo Styles Jr.,"Lorenzo Styles Jr. (S, Ohio State) projects as a Round 4-5 talent with his cleanest NFL path coming as a coverage-adjustment back-end starter in Split-safety multiplicity. The current model grade sits at 77.07, with the board currently slotting him at No. 161. developmental contributor profile; eliminates explosives with range and communication.","- Usage fit: Coverage-adjustment back-end starter within Split-safety multiplicity.
- Film translation comes from range plus communication: rotate on time, overlap windows, and close space with controlled tackling angles.
- Model + film note: developmental contributor profile; eliminates explosives with range and communication.","- PFF grade 66.0 suggests current performance volatility that needs film-confirmed cleanup.
- Communication and rotation timing must stay precise to avoid coverage busts in split-field structures.
- Open-field tackling angles must remain controlled against NFL speed and spacing stress.",,"Best early team fit: MIA. Expected early deployment: Coverage-adjustment back-end starter in Split-safety multiplicity. Early value comes from rotation versatility, overlap range, and communication that prevents explosive busts. Historical combine comp: Derek Stingley Jr. (2022), athletic-profile match 91.3%.","Lorenzo Styles Jr. S scouting report, traits, role fit, concerns, and NFL Draft projection.",
beau-stephens,Beau Stephens,"Beau Stephens (IOL, Iowa Hawkeyes) projects as a Round 4-5 talent with his cleanest NFL path coming as a power-drive guard profile in Gap / duo interior displacement menu. The current model grade sits at 77.01, with the board currently slotting him at No. 162. developmental contributor profile; stabilizes interior pocket depth and run fits.","- Usage fit: Power-drive guard profile within Gap / duo interior displacement menu.
- Film translation comes from interior control: hand placement, leverage, and communication to pass off stunts without leakage.
- Model + film note: developmental contributor profile; stabilizes interior pocket depth and run fits.","- Interior communication versus games/stunts must be consistent to protect pocket depth for the QB.
- Leverage and hand placement must hold late in reps against stronger NFL interior rushers.",,"Best early team fit: DET. Expected early deployment: Power-drive guard profile in Gap / duo interior displacement menu. Early value comes from interior pocket integrity, line-call chemistry, and efficient climb timing in zone and gap runs. Historical combine comp: Sam Jones (2018), athletic-profile match 93.55%.","Beau Stephens IOL scouting report, traits, role fit, concerns, and NFL Draft projection.",
tim-keenan-iii,Tim Keenan III,"Tim Keenan III (DT, Alabama Crimson Tide) projects as a Round 4-5 talent with his cleanest NFL path coming as a early-down anchor with interior rush upside in One-gap attack interior rotation. The current model grade sits at 76.83, with the board currently slotting him at No. 163. developmental contributor profile; controls interior gaps and collapses pocket.","- Usage fit: Early-down anchor with interior rush upside within One-gap attack interior rotation.
- Film translation comes from disruption and block control: strike timing, gap integrity, and pocket compression on long downs.
- Model + film note: developmental contributor profile; controls interior gaps and collapses pocket.","- PFF grade 70.8 suggests current performance volatility that needs film-confirmed cleanup.
- Pad-level consistency is required to convert flashes into down-to-down run-defense value.
- Pass-rush impact must hold beyond first contact when NFL guards reset and anchor late.",,"Best early team fit: BUF. Expected early deployment: Early-down anchor with interior rush upside in One-gap attack interior rotation. Early value comes from early-down run control plus enough third-down pocket push to keep fronts multiple. Historical combine comp: Keondre Coburn (2023), athletic-profile match 90.0%.","Tim Keenan III DT scouting report, traits, role fit, concerns, and NFL Draft projection.",
dallen-bentley,Dallen Bentley,"Dallen Bentley (TE, Utah) projects as a Round 4-5 talent with his cleanest NFL path coming as a move tight end mismatch piece in Detach / slot seam package. The current model grade sits at 76.95, with the board currently slotting him at No. 164. developmental contributor profile; projects as a mismatch in multiple alignments.","- Usage fit: Move tight end mismatch piece within Detach / slot seam package.
- Film translation comes from dual-phase utility: route detail vs coverage plus in-line toughness that keeps personnel groupings flexible.
- Receiver style lens: separation is driven by vertical speed stress.
- Model + film note: developmental contributor profile; projects as a mismatch in multiple alignments.","- Target-earning rate (19.2% share) suggests volume translation risk against NFL coverage.
- Blocking strain has to stay consistent so personnel usage is not telegraphed by down/distance.
- Separation profile versus man coverage must improve enough to avoid becoming only a schematic target.",,"Best early team fit: LAC. Expected early deployment: Move tight end mismatch piece in Detach / slot seam package. Early value comes from personnel flexibility, where the same player can stress seams and still survive attached to the formation. Historical combine comp: Chris Herndon (2018), athletic-profile match 94.49%.","Dallen Bentley TE scouting report, traits, role fit, concerns, and NFL Draft projection.",
kamari-ramsey,Kamari Ramsey,"Kamari Ramsey (S, USC Trojans) projects as a Round 4-5 talent with his cleanest NFL path coming as a coverage-adjustment back-end starter in Split-safety multiplicity. The current model grade sits at 76.90, with the board currently slotting him at No. 165. developmental contributor profile; eliminates explosives with range and communication.","- Usage fit: Coverage-adjustment back-end starter within Split-safety multiplicity.
- Film translation comes from range plus communication: rotate on time, overlap windows, and close space with controlled tackling angles.
- Model + film note: developmental contributor profile; eliminates explosives with range and communication.","- PFF grade 72.6 suggests current performance volatility that needs film-confirmed cleanup.
- Communication and rotation timing must stay precise to avoid coverage busts in split-field structures.
- Open-field tackling angles must remain controlled against NFL speed and spacing stress.",,"Best early team fit: MIA. Expected early deployment: Coverage-adjustment back-end starter in Split-safety multiplicity. Early value comes from rotation versatility, overlap range, and communication that prevents explosive busts. Historical combine comp: Jerron McMillian (2012), athletic-profile match 95.76%.","Kamari Ramsey S scouting report, traits, role fit, concerns, and NFL Draft projection.",
tanner-koziol,Tanner Koziol,"Tanner Koziol (TE, Houston) projects as a Round 4-5 talent with his cleanest NFL path coming as a move tight end mismatch piece in Detach / slot seam package. The current model grade sits at 76.09, with the board currently slotting him at No. 166. developmental contributor profile; projects as a mismatch in multiple alignments.","- Usage fit: Move tight end mismatch piece within Detach / slot seam package.
- Film translation comes from dual-phase utility: route detail vs coverage plus in-line toughness that keeps personnel groupings flexible.
- Receiver style lens: evaluate from snap to catch — release plan, break mechanics, edge attack, and contact-point finish — to separate true NFL translatability.
- Model + film note: developmental contributor profile; projects as a mismatch in multiple alignments.","- Route-level efficiency is light for top projection tiers (YPRR 1.72).
- Blocking strain has to stay consistent so personnel usage is not telegraphed by down/distance.
- Separation profile versus man coverage must improve enough to avoid becoming only a schematic target.",,"Best early team fit: LAC. Expected early deployment: Move tight end mismatch piece in Detach / slot seam package. Early value comes from personnel flexibility, where the same player can stress seams and still survive attached to the formation. Historical combine comp: Chase Coffman (2009), athletic-profile match 96.31%.","Tanner Koziol TE scouting report, traits, role fit, concerns, and NFL Draft projection.",
