term_id,position_group,section,trigger_type,audience,scouting_term,plain_english,use_when,avoid_when,sample_phrase,notes
qb_anticipation_distributor,QB,How He Wins,archetype,public_safe,Anticipation Distributor,Wins with timing and anticipation from structure,Use for quarterbacks who consistently throw on time before windows fully open,Do not use for toolsy creators who rely mostly on late reaction playmaking,Works from the pocket with anticipation and rhythm to beat leverage before the window closes.,Preferred for structure-first starters
qb_structure_creation_hybrid,QB,How He Wins,archetype,public_safe,Structure + Creation Hybrid,Can win from rhythm and create outside structure when needed,Use when the player shows both timing value and controlled off-script playmaking,Do not use when off-script is the only real source of value,Can stay on schedule from structure and still salvage plays when the pocket moves off the spot.,Good bridge phrase for modern starters
qb_pressure_sensitive,QB,Primary Concerns,failure_mode,public_safe,Pressure-Sensitive Game Manager,Pressure response breaks down under NFL stress,Use when pressure handling and sack creation remain clear issues,Do not use if pressure response is actually a strength,Pressure response still runs hot and cold, which can compress the margin for error versus NFL speed.,Public-safe caution phrase
qb_mental_processing,QB,How He Wins,trait,public_safe,Mental Processing,Sees the picture early and gets the ball out on time,Use when anticipation, coverage recognition, and timing are real strengths,Do not use when the profile is mostly late-reaction playmaking,Processing speed shows up in how quickly he gets the coverage picture sorted and delivers on time.,Good quarterbacking mechanism language
qb_play_speed,QB,How He Wins,trait,public_safe,Play Speed,Operates faster on tape than a stopwatch alone would suggest,Use when the player processes and reacts fast enough to beat timing windows,Do not use as a synonym for raw athleticism,Plays faster than he times because he sees it early and reacts on schedule.,Use to separate function from testing
qb_high_floor_low_ceiling,QB,Role / Scheme,archetype,internal_only,High Floor / Low Ceiling,Polished profile with limited elite upside,Use for older or physically capped passers who project as steady pros,Do not use publicly as a lazy downgrade for any non-elite athlete,The profile is polished and projectable, but the physical upside does not leave much margin for star growth.,Internal-only framing
rb_contact_creator,RB,How He Wins,archetype,public_safe,Contact Creator,Creates extra yards through balance and contact power,Use when missed tackles forced and yards after contact drive the profile,Do not use for pure speed backs without real contact value,Creates hidden yards through balance, lower-body strength, and finish after first contact.,Good for physical RBs
rb_explosive_runner,RB,How He Wins,archetype,public_safe,Explosive Runner,Generates chunk plays when he gets daylight,Use when explosive rate and breakaway profile are strong,Do not use for grinders without home-run juice,Explosive run ability changes angles once he gets into open grass.,Use with actual explosive data
rb_passing_game_utility,RB,How He Wins,archetype,public_safe,Passing-Game Utility,Adds value on passing downs as a receiver or space player,Use when routes, targets per route, or receptions matter,Do not use for backs with no passing-down role,Passing-down utility gives the role more staying power than a pure early-down grinder.,Useful for three-down framing
rb_functional_athleticism,RB,How He Wins,trait,public_safe,Functional Athleticism,Movement skill shows up in pads and through contact,Use when burst and flexibility translate better on tape than in pure timed testing,Do not use for track-speed-only backs who do not create in traffic,Functional athleticism shows up once he has to make bodies miss in tight quarters and stay balanced through contact.,Useful public-safe translation phrase
rb_body_lean,RB,How He Wins,trait,public_safe,Forward Body Lean,Stays on line and keeps momentum through contact,Use when the back consistently falls forward and finishes runs,Do not use if the runner gets knocked off course by first contact,Forward body lean keeps the run alive and turns marginal space into efficient carries.,Useful vision and finish phrase
wr_route_craft_separator,WR,How He Wins,archetype,public_safe,Route Craft Separator,Separates with pacing, leverage manipulation, and break mechanics,Use when route precision and man/zone efficiency are strengths,Do not use for straight-line field stretchers without route nuance,Route craft shows up in how he attacks leverage, varies tempo, and exits breaks without wasting steps.,Core WR phrase
wr_vertical_stressor,WR,How He Wins,archetype,public_safe,Vertical Stressor,Pushes coverage vertically and changes spacing structure,Use when deep role and efficiency are real,Do not use for short-area slot-only profiles,Vertical stress forces corners to turn and gives the offense more field to work with.,Good field-stretcher phrase
wr_volume_target_earner,WR,How He Wins,archetype,public_safe,Volume Target Earner,Earns throws consistently through separation and trust,Use when targets per route and YPRR support it,Do not use for manufactured-touch profiles only,Earns targets because he gets open on time and gives quarterbacks clean windows.,High-value usage phrasing
wr_press_answers,WR,Primary Concerns,failure_mode,public_safe,Press Answers,Release package versus press is still inconsistent,Use when press handling remains projection-sensitive,Do not use when release package is already a strength,Release plan versus press still needs more answers when defenders force timing disruption at the line.,Public-safe concern phrase
wr_body_catcher,WR,Primary Concerns,failure_mode,internal_only,Body Catcher,Uses the chest and frame instead of consistently plucking the ball,Use when the receiver repeatedly lets the ball into his body and finish consistency suffers,Do not use if the catch technique is mostly clean and occasional body catches are situational,Hands finish can get inconsistent because he will let the ball into his frame instead of snatching it cleanly away from his body.,Keep private unless you have strong film support
wr_twitchy_mover,WR,How He Wins,trait,public_safe,Twitchy Mover,Sudden mover with quick-twitch release and transition skill,Use when short-area burst and route acceleration are real separators,Do not use for long-striders who win mostly with buildup speed,Twitch shows up in the release and at the top of routes where he can snap defenders off balance.,Use for separators and dynamic space players
te_inline_move_mismatch,TE,How He Wins,archetype,public_safe,In-line + Move Mismatch,Can align attached or detached and still threaten leverage,Use when the tight end shows real versatility,Do not use for pure in-line blockers or big-slot specialists only,Alignment versatility lets him stress matchups as both an attach point and a detached target.,Preferred TE phrase
te_anchor_point,TE,Primary Concerns,failure_mode,public_safe,Anchor Point,Needs more consistent lower-half strength to hold the point in-line,Use when attached blocking remains a projection question,Do not use when play strength is already a positive,Anchor point in the run game still needs more consistency if he is going to live attached in heavier personnel.,Good public-safe TE concern
ol_anchor_consistency,OL,Primary Concerns,failure_mode,public_safe,Anchor Consistency,Anchor can soften versus NFL power,Use when bull-rush and strength concerns remain,Do not use if anchor is already a selling point,Anchor consistency versus NFL power is still the cleanest floor variable in pass protection.,Good OT/IOL concern line
ol_inside_out_recovery,OL,How He Wins,trait,public_safe,Inside-Out Recovery,Recovers balance and hand position against counters and stunts,Use when recovery skill stands out on tape,Do not use if the blocker survives mostly by size,Recovers inside-out well enough to stay connected when rushers change the picture late.,Good pass-pro phrase
ol_anchor,OL,How He Wins,trait,public_safe,Anchor,Holds ground against power rushes and keeps the pocket firm,Use when lower-body strength and base control are real strengths,Do not use when the blocker is getting walked back by bull rushers,Anchor shows up when power rushers try to collapse him and the pocket does not move.,Direct glossary term safe for public
ol_triangle_numbers,OL,Role / Scheme,trait,internal_only,Triangle Numbers,Height, weight, and speed baseline used as a physical threshold check,Use privately when discussing body-type fit and baseline traits,Do not surface on public cards because it reads too process-heavy,The body-type baseline checks enough boxes to stay in the prototype conversation.,Internal terminology only
dl_point_of_attack,DT,How He Wins,trait,public_safe,Point of Attack,Controls contact and wins the first collision,Use when the profile consistently holds or resets the line of scrimmage,Do not use for purely penetrative players who lose too much contact balance,Point-of-attack strength gives him a cleaner floor because he can absorb force and still stay in the fit.,Good trench phrase
dt_one_gap_disruptor,DT,How He Wins,archetype,public_safe,One-Gap Interior Disruptor,Creates backfield stress with burst and penetration,Use when interior pass-rush and penetration are the selling point,Do not use for pure anchor noses,Works best attacking a gap and stressing protection angles with first-step quickness.,Good DT phrase
dt_stack_and_shed,DT,How He Wins,trait,public_safe,Stack and Shed,Takes on blocks squarely before discarding to finish the rep,Use when block deconstruction is a clear strength,Do not use for gap-shooters who rarely control blocks cleanly,Can stack and shed at the point of attack instead of getting stuck on contact.,Good run-defense phrase for DT/LB
edge_true_pass_set_winner,EDGE,How He Wins,archetype,public_safe,True-Pass-Set Winner,Wins on real pass sets with burst and counters,Use when true-pass-set win data supports it,Do not use when sack totals are inflated by scheme or manufactured rushes,The rush profile holds up on true pass sets, which is the cleanest sign of NFL translatable pressure value.,Core EDGE phrase
edge_clean_pocket_finisher,EDGE,How He Wins,trait,public_safe,Clean-Pocket Finisher,Converts wins into real disruption and finish,Use when pressure converts into sacks, hits, and clean finish at a healthy rate,Do not use for empty-pressure profiles,Finishes once he clears the edge and closes cleanly on the pocket.,Good finish language
edge_rush_plan_depth,EDGE,Primary Concerns,failure_mode,public_safe,Rush-Plan Depth,Rush wins can flatten if counters do not develop,Use when pressure exists but counter menu is thin,Do not use when hand usage and counter depth are already strengths,Rush-plan depth still needs work so NFL tackles cannot sit on the first answer.,Core EDGE concern
edge_bend,EDGE,How He Wins,trait,public_safe,Bend,Can reduce surface and corner without losing speed,Use when hip/ankle flexibility lets the rusher run the arc cleanly,Do not use for power-only rushers who win through chest-to-chest force,Bend lets him flatten to the quarterback without giving away speed or balance through the turn.,Good public-safe EDGE trait
edge_set_the_edge,EDGE,How He Wins,trait,public_safe,Set the Edge,Forces runs back inside and keeps the perimeter clean,Use when early-down run integrity is a real part of the value,Do not use when the defender gets widened or displaced too often,Can set the edge and force the ball back into help instead of giving the offense easy width.,Core run-game phrase
lb_run_fit_anchor,LB,How He Wins,archetype,public_safe,Run-Fit Anchor,Controls run fits with key recognition and physicality,Use for stack linebackers with a strong run-defense profile,Do not use for overhang or coverage-first linebackers,Run-fit value comes from key discipline, downhill trigger, and the ability to meet blocks without getting displaced.,Core LB phrase
lb_coverage_range,LB,How He Wins,archetype,public_safe,Coverage Range,Carries space and closes windows in underneath coverage,Use when coverage grade and range traits are clear,Do not use for pressure-only hybrids,Coverage range gives him value beyond the box because he can carry space and close throwing lanes.,Core LB phrase
lb_pressure_utility,LB,How He Wins,archetype,public_safe,Pressure Utility,Adds value as a blitzer or pressure mover,Use when blitz or pass-rush impact is real,Do not use for pure off-ball types with no pressure history,Pressure utility shows up when he is sent or moved because he times entry and finishes through contact.,Useful for hybrid LBs
lb_stack_and_shed,LB,How He Wins,trait,public_safe,Stack and Shed,Takes on blocks squarely and discards them to stay clean,Use when the linebacker consistently defeats second-level blockers,Do not use when the player survives mostly by slipping blocks,Can stack and shed instead of staying blocked, which keeps the run-fit clean through traffic.,Excellent public-safe LB phrase
lb_play_speed,LB,How He Wins,trait,public_safe,Play Speed,Sees the rep early enough to trigger before the alley fully opens,Use when processing and range combine to make the player look faster in pads than on a stopwatch,Do not use for athletes who are late to diagnose,Play speed shows up because he gets the picture sorted quickly and beats blockers to the spot.,Good LB/S phrase
db_target_deterrent,DB,How He Wins,archetype,public_safe,Target Deterrent,Discourages throws through coverage quality and leverage control,Use when snaps per target and target suppression support it,Do not use when the player is attacked often,Target deterrence is part of the value because quarterbacks are not living on clean access throws into his area.,Core DB phrase
db_ball_disruptor,DB,How He Wins,trait,public_safe,Ball Disruptor,Finds and finishes on the football,Use when PBUs, forced incompletion, or INT profile supports it,Do not use when ball production is weak,Ball disruption shows up at the catch point with timing, length, and late-play finish.,Core DB phrase
db_scheme_translator,DB,How He Wins,archetype,public_safe,Scheme Translator,Can function across man, zone, deep, and slot responsibilities,Use when man-zone versatility is real,Do not use for role-locked DBs,Scheme translation is cleaner because the profile survives more than one coverage family.,Versatility phrase
db_angle_discipline,DB,Primary Concerns,failure_mode,public_safe,Angle Discipline,Pursuit and finish angles can break down,Use when missed tackles or run-support issues persist,Do not use when tackling is a clear strength,Angle discipline and finish consistency still need to tighten when the rep spills into space.,Core DB concern
db_click_and_close,DB,How He Wins,trait,public_safe,Click and Close,Transitions cleanly and drives downhill on the throw,Use when the corner or safety can trigger out of pedal or off leverage without wasted steps,Do not use for linear athletes who need too much gather to redirect,Click-and-close ability shows up when the route breaks and he can plant, drive, and arrive on the football without losing balance.,Strong public-safe DB phrase
db_reactive_athleticism,DB,How He Wins,trait,public_safe,Reactive Athleticism,Movement skill shows up in response to route stimulus,Use when the player’s coverage movement is more impressive in live reaction than in straight testing,Do not use as a generic athletic compliment,Reactive athleticism shows up when the route changes picture and he still matches it without panic or wasted motion.,Good explanation for cover movement
db_oily_hips,DB,How He Wins,trait,internal_only,Oily Hips,Loose and fluid hips for smooth transitions through route changes,Use privately when evaluating corners or safeties with exceptional transition fluidity,Do not use on public cards because the phrase is slang-heavy,Transition fluidity is a real strength and shows up when he opens, flips, and drives without stiffness.,Internal scout-slang only
generic_twitchy,WR|RB|EDGE|DB,How He Wins,trait,public_safe,Twitchy,Sudden mover with quick first-step burst and redirection,Use when short-area movement is a true weapon,Do not use as a substitute for functional processing or play speed,Twitch shows up early in the rep and forces defenders to react to his sudden movement profile.,Public-safe shorthand for sudden movers
generic_jag,QB|RB|WR|TE|OL|EDGE|DT|LB|DB,Primary Concerns,failure_mode,internal_only,JAG,Competent player without difference-making traits,Use privately when the player is functional but lacks any real separator traits,Do not use on public cards because it reads dismissive and unpolished,The projection looks more steady than difference-making unless one part of the profile takes a real jump.,Internal shorthand only
generic_football_character,QB|RB|WR|TE|OL|EDGE|DT|LB|DB,Role / Scheme,trait,internal_only,Football Character,Work ethic, coachability, and love of the process,Use privately when building internal confidence on developmental outcomes,Do not surface publicly unless you have direct sourced reporting and legal comfort,The work habits and day-to-day approach support the player lasting in an NFL building.,Keep private unless explicitly sourced
